{
  "option_set_id": "opts_c9239fadbec07554859c0374",
  "contract_version": "1.0.0",
  "company_id": "company_demo",
  "decision_subject_id": "subject_reduce_water_cost",
  "objective": {
    "intent": "reduce_water_use_and_cost",
    "description": "Reduce water use without service-quality loss"
  },
  "options": [
    {
      "option_id": "opt_83370e2329a4ef01d3562fd9",
      "contract_version": "1.0.0",
      "company_id": "company_demo",
      "decision_subject_id": "subject_reduce_water_cost",
      "kind": "action",
      "title": "Do nothing until evidence improves",
      "description": null,
      "intent": "reduce_water_use_and_cost",
      "target_refs": [],
      "parameters": {
        "action": "defer"
      },
      "source": "policy",
      "provenance": [
        {
          "provider_id": "policy",
          "source_id": "policy",
          "source_record_id": null,
          "evidence_ids": [],
          "context_fact_ids": []
        }
      ],
      "discovery_rationale": [
        "Valid baseline alternative when change risk exceeds evidence confidence"
      ],
      "feasibility": {
        "state": "eligible",
        "hard_failures": [],
        "soft_constraints": [],
        "unknowns": []
      },
      "constraint_refs": [],
      "evidence_refs": [],
      "confidence": 0.65,
      "created_at": "2026-09-03T00:10:00Z",
      "extension_data": {}
    },
    {
      "option_id": "opt_6f35adfd297626d867f9b8fc",
      "contract_version": "1.0.0",
      "company_id": "company_demo",
      "decision_subject_id": "subject_reduce_water_cost",
      "kind": "intervention",
      "title": "Install recirculation stage",
      "description": null,
      "intent": "reduce_water_use_and_cost",
      "target_refs": [
        {
          "entity_id": "facility_north",
          "entity_type": "resource",
          "role": "intervention_target"
        }
      ],
      "parameters": {
        "intervention": "water_recirculation"
      },
      "source": "knowledge",
      "provenance": [
        {
          "provider_id": "knowledge_env",
          "source_id": "knowledge_env",
          "source_record_id": null,
          "evidence_ids": [
            "ev_water_audit"
          ],
          "context_fact_ids": []
        }
      ],
      "discovery_rationale": [
        "Knowledge pattern applicable to repeated rinse-water demand"
      ],
      "feasibility": {
        "state": "eligible",
        "hard_failures": [],
        "soft_constraints": [
          "capital expenditure review"
        ],
        "unknowns": []
      },
      "constraint_refs": [
        "constraint_budget"
      ],
      "evidence_refs": [
        "ev_water_audit"
      ],
      "confidence": 0.82,
      "created_at": "2026-09-03T00:10:00Z",
      "extension_data": {}
    },
    {
      "option_id": "opt_593a9b72692081f28effaa63",
      "contract_version": "1.0.0",
      "company_id": "company_demo",
      "decision_subject_id": "subject_reduce_water_cost",
      "kind": "resource",
      "title": "Use high-efficiency rinse unit",
      "description": null,
      "intent": "reduce_water_use_and_cost",
      "target_refs": [
        {
          "entity_id": "asset_rinse_02",
          "entity_type": "asset",
          "role": "replacement_resource"
        }
      ],
      "parameters": {
        "mode": "substitute"
      },
      "source": "internal_catalog",
      "provenance": [
        {
          "provider_id": "ops_catalog",
          "source_id": "ops_catalog",
          "source_record_id": null,
          "evidence_ids": [
            "ev_asset_efficiency"
          ],
          "context_fact_ids": [
            "fact_water_use"
          ]
        }
      ],
      "discovery_rationale": [
        "Available internal resource with lower measured water use"
      ],
      "feasibility": {
        "state": "eligible",
        "hard_failures": [],
        "soft_constraints": [],
        "unknowns": []
      },
      "constraint_refs": [],
      "evidence_refs": [
        "ev_asset_efficiency"
      ],
      "confidence": 0.88,
      "created_at": "2026-09-03T00:10:00Z",
      "extension_data": {}
    },
    {
      "option_id": "opt_020ef5d0307c1a196cfba92a",
      "contract_version": "1.0.0",
      "company_id": "company_demo",
      "decision_subject_id": "subject_reduce_water_cost",
      "kind": "schedule",
      "title": "Batch rinse-intensive work",
      "description": null,
      "intent": "reduce_water_use_and_cost",
      "target_refs": [],
      "parameters": {
        "batch_window": "late_shift"
      },
      "source": "system_context",
      "provenance": [
        {
          "provider_id": "scheduler",
          "source_id": "scheduler",
          "source_record_id": null,
          "evidence_ids": [],
          "context_fact_ids": []
        }
      ],
      "discovery_rationale": [
        "Potential reduction in repeated startup/flush cycles"
      ],
      "feasibility": {
        "state": "unknown",
        "hard_failures": [],
        "soft_constraints": [],
        "unknowns": [
          "late_shift_capacity_confirmation"
        ]
      },
      "constraint_refs": [],
      "evidence_refs": [],
      "confidence": 0.72,
      "created_at": "2026-09-03T00:10:00Z",
      "extension_data": {}
    }
  ],
  "eligible_option_ids": [
    "opt_83370e2329a4ef01d3562fd9",
    "opt_6f35adfd297626d867f9b8fc",
    "opt_593a9b72692081f28effaa63"
  ],
  "ineligible_option_ids": [],
  "unknown_option_ids": [
    "opt_020ef5d0307c1a196cfba92a"
  ],
  "discovery_receipts": [
    {
      "provider_id": "ops_catalog",
      "source": "internal_catalog",
      "candidate_count": 1,
      "errors": []
    },
    {
      "provider_id": "knowledge_env",
      "source": "knowledge",
      "candidate_count": 1,
      "errors": []
    },
    {
      "provider_id": "scheduler",
      "source": "system_context",
      "candidate_count": 1,
      "errors": []
    },
    {
      "provider_id": "policy",
      "source": "policy",
      "candidate_count": 1,
      "errors": []
    }
  ],
  "generated_at": "2026-09-03T00:10:00Z",
  "extension_data": {}
}
